{
  "$schema": "https://json-schema.org/draft/2020-12/schema",
  "$id": "https://a204.batang/shared/schemas/layout_import_v2.schema.json",
  "title": "LayoutImportV2",
  "description": "Project layout JSON contract used to import a new IFC model from room-centric data with v2 generation options.",
  "type": "object",
  "additionalProperties": false,
  "required": ["schema_version", "id", "name", "rooms"],
  "properties": {
    "schema_version": {
      "const": "v2"
    },
    "id": {
      "type": "string",
      "format": "uuid"
    },
    "name": {
      "type": "string",
      "minLength": 1,
      "maxLength": 255
    },
    "rooms": {
      "type": "array",
      "minItems": 1,
      "items": {
        "$ref": "#/$defs/room"
      }
    },
    "zones": {
      "type": "array",
      "items": {
        "$ref": "#/$defs/zone"
      }
    },
    "adjacency": {
      "type": "array",
      "items": {
        "$ref": "#/$defs/adjacency"
      }
    },
    "boundaries": {
      "type": "array",
      "items": {
        "$ref": "#/$defs/boundary"
      }
    },
    "generation_options": {
      "$ref": "#/$defs/generationOptions",
      "default": {
        "generate_spaces": true,
        "generate_walls": true,
        "generate_slabs": true,
        "generate_roof": true,
        "generate_openings": false
      }
    },
    "modeling_defaults": {
      "$ref": "#/$defs/modelingDefaults"
    },
    "generation_policy": {
      "$ref": "#/$defs/generationPolicy",
      "default": {
        "boundary_wall_mode": "outer_boundary",
        "shared_wall_policy": "from_adjacency",
        "roof_shape": "flat"
      }
    }
  },
  "$defs": {
    "roomType": {
      "type": "string",
      "enum": [
        "living",
        "bedroom",
        "kitchen",
        "bathroom",
        "office",
        "entrance",
        "corridor",
        "other"
      ]
    },
    "wallType": {
      "type": "string",
      "enum": ["general", "exterior", "load_bearing", "partition"]
    },
    "connectionIntent": {
      "type": "string",
      "enum": ["circulation", "open_passage", "weak_relation", "merge"]
    },
    "connectionStrength": {
      "type": "string",
      "enum": ["strong", "normal", "weak"]
    },
    "hexColor": {
      "type": "string",
      "pattern": "^#[0-9A-Fa-f]{6}$"
    },
    "coordinatePair": {
      "type": "array",
      "prefixItems": [
        { "type": "number" },
        { "type": "number" }
      ],
      "items": false,
      "minItems": 2,
      "maxItems": 2
    },
    "room": {
      "type": "object",
      "additionalProperties": false,
      "required": [
        "id",
        "name",
        "type",
        "width",
        "height",
        "floor",
        "x",
        "y",
        "angle",
        "locked"
      ],
      "properties": {
        "id": {
          "type": "string",
          "minLength": 1,
          "maxLength": 128
        },
        "source_bubble_id": {
          "type": "string",
          "minLength": 1,
          "maxLength": 128
        },
        "original_label": {
          "type": "string",
          "minLength": 1,
          "maxLength": 255
        },
        "original_type": {
          "type": "string",
          "minLength": 1,
          "maxLength": 128
        },
        "name": {
          "type": "string",
          "minLength": 1,
          "maxLength": 255
        },
        "type": {
          "$ref": "#/$defs/roomType"
        },
        "width": {
          "type": "integer",
          "exclusiveMinimum": 0
        },
        "height": {
          "type": "integer",
          "exclusiveMinimum": 0
        },
        "floor": {
          "type": "integer",
          "minimum": 1
        },
        "x": {
          "type": "number"
        },
        "y": {
          "type": "number"
        },
        "angle": {
          "type": "number"
        },
        "locked": {
          "type": "boolean"
        },
        "material": {
          "type": "string",
          "minLength": 1,
          "maxLength": 128
        },
        "color": {
          "$ref": "#/$defs/hexColor"
        },
        "wall_type": {
          "$ref": "#/$defs/wallType"
        },
        "zoneId": {
          "oneOf": [
            {
              "type": "string",
              "minLength": 1,
              "maxLength": 128
            },
            {
              "type": "null"
            }
          ]
        }
      }
    },
    "zone": {
      "type": "object",
      "additionalProperties": false,
      "required": ["id", "name", "color"],
      "properties": {
        "id": {
          "type": "string",
          "minLength": 1,
          "maxLength": 128
        },
        "name": {
          "type": "string",
          "minLength": 1,
          "maxLength": 255
        },
        "color": {
          "$ref": "#/$defs/hexColor"
        }
      }
    },
    "adjacency": {
      "type": "object",
      "additionalProperties": false,
      "required": ["from_room_id", "to_room_id", "strength"],
      "properties": {
        "id": {
          "type": "string",
          "minLength": 1,
          "maxLength": 128
        },
        "from_room_id": {
          "type": "string",
          "minLength": 1,
          "maxLength": 128
        },
        "to_room_id": {
          "type": "string",
          "minLength": 1,
          "maxLength": 128
        },
        "strength": {
          "type": "number",
          "minimum": 0,
          "maximum": 1
        },
        "intent": {
          "$ref": "#/$defs/connectionIntent"
        },
        "connection_strength": {
          "$ref": "#/$defs/connectionStrength"
        },
        "source_bubble_id": {
          "type": "string",
          "minLength": 1,
          "maxLength": 128
        },
        "target_bubble_id": {
          "type": "string",
          "minLength": 1,
          "maxLength": 128
        }
      }
    },
    "boundary": {
      "type": "object",
      "additionalProperties": false,
      "required": ["floor", "polygon"],
      "properties": {
        "floor": {
          "type": "integer",
          "minimum": 1
        },
        "polygon": {
          "type": "array",
          "minItems": 3,
          "items": {
            "$ref": "#/$defs/coordinatePair"
          }
        }
      }
    },
    "generationOptions": {
      "type": "object",
      "additionalProperties": false,
      "properties": {
        "generate_spaces": {
          "type": "boolean",
          "default": true
        },
        "generate_walls": {
          "type": "boolean",
          "default": true
        },
        "generate_slabs": {
          "type": "boolean",
          "default": true
        },
        "generate_roof": {
          "type": "boolean",
          "default": true
        },
        "generate_openings": {
          "type": "boolean",
          "default": false
        }
      }
    },
    "modelingDefaults": {
      "type": "object",
      "additionalProperties": false,
      "properties": {
        "space_height_mm": {
          "type": "integer",
          "exclusiveMinimum": 0
        },
        "wall_thickness_mm": {
          "type": "integer",
          "exclusiveMinimum": 0
        },
        "slab_thickness_mm": {
          "type": "integer",
          "exclusiveMinimum": 0
        },
        "roof_height_mm": {
          "type": "integer",
          "exclusiveMinimum": 0
        }
      }
    },
    "generationPolicy": {
      "type": "object",
      "additionalProperties": false,
      "properties": {
        "boundary_wall_mode": {
          "type": "string",
          "enum": ["outer_boundary"],
          "default": "outer_boundary"
        },
        "shared_wall_policy": {
          "type": "string",
          "enum": ["from_adjacency"],
          "default": "from_adjacency"
        },
        "roof_shape": {
          "type": "string",
          "enum": ["flat"],
          "default": "flat"
        }
      }
    }
  },
  "examples": [
    {
      "schema_version": "v2",
      "id": "550e8400-e29b-41d4-a716-446655440000",
      "name": "sample-project",
      "rooms": [
        {
          "id": "room-living-01",
          "source_bubble_id": "bubble-living-01",
          "original_label": "Living Room",
          "original_type": "living",
          "name": "Living Room",
          "type": "living",
          "width": 4200,
          "height": 3800,
          "floor": 1,
          "x": 5000.0,
          "y": 4000.0,
          "angle": 0.0,
          "locked": false,
          "material": "wood",
          "color": "#FF5733",
          "wall_type": "general",
          "zoneId": "zone-common"
        }
      ],
      "zones": [
        {
          "id": "zone-common",
          "name": "Common",
          "color": "#FF5733"
        }
      ],
      "boundaries": [
        {
          "floor": 1,
          "polygon": [
            [0.0, 0.0],
            [14000.0, 0.0],
            [14000.0, 9000.0],
            [0.0, 9000.0]
          ]
        }
      ],
      "generation_options": {
        "generate_spaces": true,
        "generate_walls": true,
        "generate_slabs": true,
        "generate_roof": true,
        "generate_openings": false
      },
      "modeling_defaults": {
        "space_height_mm": 2700,
        "wall_thickness_mm": 200,
        "slab_thickness_mm": 180,
        "roof_height_mm": 400
      },
      "generation_policy": {
        "boundary_wall_mode": "outer_boundary",
        "shared_wall_policy": "from_adjacency",
        "roof_shape": "flat"
      }
    }
  ]
}
