{
  "schema_version": "v2",
  "id": "550e8400-e29b-41d4-a716-446655440000",
  "name": "sample-project",
  "rooms": [
    {
      "id": "room-living-01",
      "name": "Living Room",
      "type": "living",
      "width": 4200,
      "height": 3800,
      "floor": 1,
      "x": 5000.0,
      "y": 4000.0,
      "angle": 0.0,
      "locked": false,
      "zoneId": "zone-common"
    },
    {
      "id": "room-bed-01",
      "name": "Bedroom",
      "type": "bedroom",
      "width": 3600,
      "height": 3200,
      "floor": 2,
      "x": 9000.0,
      "y": 4000.0,
      "angle": 0.0,
      "locked": false
    }
  ],
  "zones": [
    {
      "id": "zone-common",
      "name": "Common",
      "color": "#FF5733"
    }
  ],
  "boundaries": [
    {
      "floor": 1,
      "polygon": [
        [0.0, 0.0],
        [4200.0, 0.0],
        [4200.0, 3800.0],
        [0.0, 3800.0]
      ]
    },
    {
      "floor": 2,
      "polygon": [
        [0.0, 0.0],
        [3600.0, 0.0],
        [3600.0, 3200.0],
        [0.0, 3200.0]
      ]
    }
  ],
  "generation_options": {
    "generate_spaces": true,
    "generate_walls": true,
    "generate_slabs": true,
    "generate_roof": true,
    "generate_openings": false
  },
  "modeling_defaults": {
    "space_height_mm": 2700,
    "wall_thickness_mm": 200,
    "slab_thickness_mm": 180,
    "roof_height_mm": 400
  },
  "generation_policy": {
    "boundary_wall_mode": "outer_boundary",
    "shared_wall_policy": "from_adjacency",
    "roof_shape": "flat"
  }
}
